{
  "schema_version": 1,
  "command_id": "CMD-ADVANCE-match-three-to-requirements-001",
  "workflow_id": "WF-match-three-game",
  "expected_revision": 1,
  "command_type": "ADVANCE_PHASE",
  "actor": "local-orchestrator",
  "occurred_at": "2026-08-12T06:54:00.000Z",
  "reason": "用户确认按方案开始制作，进入需求整理阶段",
  "target_phase": "REQUIREMENTS",
  "candidate_commit": null,
  "payload": {}
}
