{
  "schema_version": 1,
  "command_id": "CMD-ADVANCE-todo-app-to-dev",
  "workflow_id": "WF-todo-app",
  "expected_revision": 5,
  "command_type": "ADVANCE_PHASE",
  "actor": "local-orchestrator",
  "occurred_at": "2026-08-11T03:33:00.000Z",
  "reason": "架构设计通过 ARCHITECTURE_GATE，技术栈选型合理，5 份 ADR 覆盖关键决策，进入 DEVELOPMENT 阶段",
  "target_phase": "DEVELOPMENT",
  "payload": {}
}
