{
  "schema_version": 1,
  "command_id": "CMD-ADVANCE-chat-demo-to-requirements",
  "workflow_id": "WF-chat-demo",
  "expected_revision": 1,
  "command_type": "ADVANCE_PHASE",
  "actor": "local-orchestrator",
  "occurred_at": "2026-08-11T09:48:00.000Z",
  "reason": "从 INTAKE 进入 REQUIREMENTS 阶段 - 聊天 Demo 需求包括：单人 Web 聊天应用，支持群聊和私聊",
  "target_phase": "REQUIREMENTS",
  "payload": {
    "user_requirements": "创建一个单用户可用的 Web 聊天 Demo 应用。核心功能：1) 群聊功能 - 用户可创建群组并群发消息；2) 私聊功能 - 用户可与单个联系人一对一私聊。使用纯前端实现，无需后端服务器。所有数据在本地存储。界面应简洁实用。"
  }
}
