{
  "schema_version": 1,
  "command_id": "CMD-COMPLETE-todo-app",
  "workflow_id": "WF-todo-app",
  "expected_revision": 11,
  "command_type": "COMPLETE",
  "actor": "local-orchestrator",
  "occurred_at": "2026-08-11T03:53:00.000Z",
  "reason": "Todo App 开发完成，所有阶段通过，可交付",
  "outcome": "READY_FOR_OPERATIONS_HANDOFF",
  "payload": {}
}
