{
  "schema_version": 1,
  "command_id": "CMD-ADVANCE-todo-app-release",
  "workflow_id": "WF-todo-app",
  "expected_revision": 9,
  "command_type": "ADVANCE_PHASE",
  "actor": "local-orchestrator",
  "occurred_at": "2026-08-11T03:52:00.000Z",
  "reason": "测试构建通过，进入 RELEASE_VERIFICATION",
  "target_phase": "RELEASE_VERIFICATION",
  "payload": {}
}
