{
  "schema_version": 1,
  "command_id": "CMD-ADVANCE-todo-app-test-review",
  "workflow_id": "WF-todo-app",
  "expected_revision": 8,
  "command_type": "ADVANCE_PHASE",
  "actor": "local-orchestrator",
  "occurred_at": "2026-08-11T03:52:00.000Z",
  "reason": "构建测试通过，进入 TEST_CODE_REVIEW",
  "target_phase": "TEST_CODE_REVIEW",
  "payload": {}
}
