{
  "schema_version": 1,
  "command_id": "CMD-ADVANCE-todo-app-to-test",
  "workflow_id": "WF-todo-app",
  "expected_revision": 7,
  "command_type": "ADVANCE_PHASE",
  "actor": "local-orchestrator",
  "occurred_at": "2026-08-11T03:50:00.000Z",
  "reason": "代码审查通过 (APPROVE)，5 个低级问题不阻塞，进入 TESTING 阶段",
  "target_phase": "TESTING",
  "payload": {}
}
