{
  "schema_version": 1,
  "command_id": "CMD-ADVANCE-todo-app-to-arch",
  "workflow_id": "WF-todo-app",
  "expected_revision": 3,
  "command_type": "ADVANCE_PHASE",
  "actor": "local-orchestrator",
  "occurred_at": "2026-08-11T03:20:00.000Z",
  "reason": "需求分析通过 REQUIREMENT_GATE，20 条 AC 可验证，无阻塞项，进入 ARCHITECTURE 阶段",
  "target_phase": "ARCHITECTURE",
  "payload": {}
}
