{
  "schema_version": 1,
  "command_id": "CMD-BOOTSTRAP-chat-app-001",
  "workflow_id": "WF-chat-app",
  "expected_revision": 0,
  "command_type": "BOOTSTRAP",
  "actor": "local-orchestrator",
  "occurred_at": "2026-08-11T09:47:00.000Z",
  "reason": "创建聊天 Demo Web 应用工作流 - 用户请求单人使用的 Web 聊天应用，支持群聊和私聊功能",
  "candidate_commit": null,
  "payload": {
    "contract_set_id": "chat-app-v1.0",
    "agent_bundle_id": "5ea60658a5c6eb8ff7fa5ec07628f8752333ffd197cf0c1afe9f077e44e621b5"
  }
}
