{
  "schema_version": 1,
  "command_id": "CMD-ADVANCE-todo-app-to-review",
  "workflow_id": "WF-todo-app",
  "expected_revision": 6,
  "command_type": "ADVANCE_PHASE",
  "actor": "local-orchestrator",
  "occurred_at": "2026-08-11T03:45:00.000Z",
  "reason": "开发完成，46 文件 1699 行代码，16/20 AC 覆盖，进入 CODE_REVIEW 阶段",
  "target_phase": "CODE_REVIEW",
  "payload": {}
}
