{
  "schema_version": 1,
  "command_id": "CMD-ADVANCE-todo-app-to-requirements",
  "workflow_id": "WF-todo-app",
  "expected_revision": 1,
  "command_type": "ADVANCE_PHASE",
  "actor": "local-orchestrator",
  "occurred_at": "2026-08-11T03:13:00.000Z",
  "reason": "用户选择标准流程，从 INTAKE 进入 REQUIREMENTS 阶段",
  "target_phase": "REQUIREMENTS",
  "payload": {}
}
