{
  "schema_version": 1,
  "command_id": "CMD-ADVANCE-todo-app-arch-gate",
  "workflow_id": "WF-todo-app",
  "expected_revision": 4,
  "command_type": "ADVANCE_PHASE",
  "actor": "local-orchestrator",
  "occurred_at": "2026-08-11T03:33:00.000Z",
  "reason": "架构设计完成，进入 ARCHITECTURE_GATE 阶段",
  "target_phase": "ARCHITECTURE_GATE",
  "payload": {}
}
