{
  "schema_version": 1,
  "command_id": "CMD-ADVANCE-todo-app-to-final",
  "workflow_id": "WF-todo-app",
  "expected_revision": 8,
  "command_type": "ADVANCE_PHASE",
  "actor": "local-orchestrator",
  "occurred_at": "2026-08-11T03:52:00.000Z",
  "reason": "测试构建通过，直接推进到 FINAL_REPORT 总结阶段",
  "target_phase": "FINAL_REPORT",
  "payload": {}
}
